{
  "documentMetadata": {
    "transcriptCheckNumber": "１０２ＡＦ０２２９４４ＲＥＧ０２Ｅ９ＥＣ６８７４７５０４Ｃ５３Ａ８０Ｂ７０Ｂ２８６Ｃ６８１７９",
    "transcriptNumber": "大安電謄字第022944號",
    "printDateTime": "民國102年07月08日14時21分",
    "issuingOffice": "臺北市大安地政事務所",
    "managingOffice": "臺北市大安地政事務所",
    "pageNumber": 1,
    "verificationUrl": "http://ttt.land.net.tw"
  },
  "buildingIdentification": {
    "buildingNumber": "01691-000",
    "district": "大安區",
    "section": "復興段二小段",
    "registrationDate": "民國093年03月22日",
    "registrationReason": "門牌整編",
    "address": "敦化南路一段２３６巷５號十樓",
    "landLotNumber": "復興段二小段 0007-0000",
    "mainPurpose": "住家用",
    "mainMaterial": "鋼筋混凝土造",
    "totalFloors": 14,
    "totalArea": 224.82,
    "floorDetails": [
      {
        "floorLevel": "十層",
        "area": 224.82
      }
    ],
    "constructionCompletionDate": "民國---年--月--日",
    "auxiliaryBuildings": [
      {
        "purpose": "陽台",
        "area": 36.18
      }
    ],
    "commonAreas": [
      {
        "buildingNumber": "01719-000",
        "area": 2424.04,
        "ownershipRatio": "242404分之3564"
      }
    ],
    "buildingPermitNumber": "６７使字１５５號",
    "otherRegistrationNotes": [
      "１６８３公設持分１１０３７７９３４１８８分之１０２１５９４００９",
      "１７１２公設持分１１０３７７９３４１８８分之１５９７１２１３０４",
      "１６８７公設持分１１０３７７９３４１８８分之１６１８９２５０８０",
      "１６６１公設持分１１０３７７９３４１８８分之１６１８９２５０８０",
      "１７１３建號公設持分１１０３７７９３４１８８分之１５９７２３８３０１",
      "１７０４建號公設持分１１０３７７９３４１８８分之１６１８９２５０８０",
      "１６８７建號公設持分１１０３７７９３４１８８分之１６１８９２５０８０",
      "主建物１７１２建號權利範圍１１０３７７９３４１８８分之１５９７１２１３０４",
      "１６７９建號公設持分１１０３７７９３４１８８分之１６１８９２５０８０",
      "１６８０建號公設持分１１０３７７９３４１８８分之１６１８９２５０８０"
    ]
  },
  "ownershipSection": {
    "registrationSequence": "0002",
    "registrationDate": "民國093年06月02日",
    "registrationReason": "買賣",
    "reasonOccurrenceDate": "民國093年03月17日",
    "owner": {
      "name": "謝裕隆",
      "address": "台北市大安區仁愛里１９鄰敦化南路１段２３６巷５號１０樓"
    },
    "ownershipRatio": "全部",
    "certificateNumber": "099北大字第002875號",
    "relatedEncumbrances": [
      "0004-000",
      "0005-000"
    ],
    "otherOwnershipNotes": []
  },
  "extractionMetadata": {
    "extractionTimestamp": "2024-01-11T05:00:00Z",
    "extractionMethod": "claude-vision",
    "confidenceScore": 0.95,
    "fieldsRequiringReview": [
      "constructionCompletionDate"
    ],
    "notes": "Construction completion date is incomplete in original document (民國---年--月--日). Some common area ownership ratios are very long numbers and may require verification. Multiple common area entries suggest this is a condominium unit."
  }
}
